{
  "$schema": "https://json-schema.org/draft/2020-12/schema",
  "$id": "https://devpass.example/schemas/verification-result.schema.json",
  "title": "DevPass Verification Result Reference Schema",
  "description": "Non-normative public reference interface for representing a machine-readable DevPass verification result.",
  "type": "object",
  "additionalProperties": false,
  "required": [
    "schema_version",
    "verification_result_id",
    "developer_record_id",
    "status",
    "verified_at"
  ],
  "properties": {
    "schema_version": {
      "type": "string",
      "const": "0.1"
    },
    "verification_result_id": {
      "type": "string",
      "minLength": 1,
      "description": "Unique identifier for the verification result."
    },
    "developer_record_id": {
      "type": "string",
      "minLength": 1,
      "description": "Reference to the developer record evaluated."
    },
    "status": {
      "type": "string",
      "enum": [
        "verified",
        "not_verified",
        "additional_evidence_required",
        "additional_review_required",
        "unable_to_verify"
      ],
      "description": "Simplified public reference verification status. This vocabulary is non-normative."
    },
    "verification_context_reference": {
      "type": "string",
      "minLength": 1,
      "description": "Optional reference to the verification context or implementation-defined evaluation scope."
    },
    "attestation_references": {
      "type": "array",
      "items": {
        "type": "string",
        "minLength": 1
      },
      "description": "Optional references to attestations associated with the verification result."
    },
    "evidence_references": {
      "type": "array",
      "items": {
        "type": "string",
        "minLength": 1
      },
      "description": "Optional references to evidence associated with the verification result."
    },
    "verified_at": {
      "type": "string",
      "format": "date-time",
      "description": "Timestamp at which the verification result was produced."
    },
    "valid_until": {
      "type": [
        "string",
        "null"
      ],
      "format": "date-time",
      "description": "Optional timestamp after which the result should not be relied upon without reevaluation."
    },
    "provenance_reference": {
      "type": "string",
      "minLength": 1,
      "description": "Optional implementation-defined provenance or integrity reference."
    },
    "metadata": {
      "type": "object",
      "description": "Optional implementation-specific metadata. Consumers should not treat metadata as normative scoring, fraud, identity, or clearance semantics."
    }
  }
}
